tour_id,title,rating,n_reviews,duration,is_pickup_offered,is_risk_free_cancellation,overview,starting_price_usd,duration_type
174,"Shore Excursion in SFO - Enchanted Napa & Sonoma Wine Tour in SUV",NULL,0,9.0,1,1,"Explore and relish the enchanted day trip to California's famous wine country on this full-day tour of Napa and Sonoma County. Tour and taste wine at a Napa Valley landmark—Castello di Amorosa. You’ll stop for photos of the iconic Golden Gate Bridge, enjoy wine tastings in both Napa and Sonoma, where you'll take in the delightful notes of each region, and have free time to explore historic Sonoma Square. Many of the wineries that will be visited are some of the oldest wine making families wine in the Napa and Sonoma Valley. You’ll learn of their family histories and first beginnings in California’s most famous Wine Country.",241.33,"More than 4 hours"
175,"Exclusive Napa Valley Wine Tour",5.0,1,8.0,1,0,"Spending extended time in San Francisco? What a better way to spend your day than a romantic, relaxing San Francisco to Napa Valley Wine Tour—without your car! Leave the itinerary and transportation to us. Sit back, relax, and enjoy our 8-hour private wine tasting tours that start in San Francisco and head about an hour north to the vineyard-draped hills of Napa Valley. Take in the beauty of the rolling hills speckled with magnificent oak trees and lush vineyards. We’ll take you from San Francisco to Napa Valley for a full day of wine tasting experiences at some of the best Napa wineries in the world. With several hundred wineries to choose from, you will taste a wide array of wines and experience the unique ambiance of each winery.",743.97,"More than 4 hours"
176,"Private Tour of John Muire and Sausalito",NULL,0,5.0,1,0,"This private tour offers a uniquely intimate and personalized experience compared to the typical hop-on, hop-off tours. While the latter provides flexibility and a broad overview of the city's highlights, this special tour delves deeper, offering a more immersive and detailed exploration of each destination. On this private tour, you benefit from a tailored itinerary, crafted to match your interests and pace. You'll enjoy in-depth insights and stories that bring each location to life in a way that larger, more generic tours can't match. The flexibility to linger at sites that captivate you, or to skip those that don’t, ensures a more satisfying and personal experience. Moreover, the comfort and exclusivity of a private tour mean you're not navigating crowds or adhering to a rigid schedule. This allows for spontaneous detours and discoveries, making the journey as memorable as the destinations themselves. In essence, this tour isn't just about seeing the sights.",466.32,"More than 4 hours"
177,"Private Napa Sonoma Wine Tour with Guide",NULL,0,8.0,1,1,"Our guide will convey unique details about the scenery and nature; including the mountains, towns, wineries, and points of interest, we will be passing as we drive thru Sonoma, Napa, and North of San Francisco. Additionally, you will be taken to 3 three unique wineries (Jarvis, Raymond, and Castello Di Amorosa). 1 is inside a remarkable cave; the other offers an array of thorough educational experiences about wine and wineries and the other is a medieval castle. All 3 wineries offer renowned wine. We will be driving in a luxury SUV with plenty of Whole Foods Spring Water. If you want to purchase wine or anything else; we will have plenty of room and a method to keep wine secure.",778.65,"More than 4 hours"
178,"Private Monterey, Carmel and 17-Mile Drive Day Trip from San Francisco",5.0,1,11.0,1,1,"Cruise along California's spectacular coastline with our luxury vehicle exclusive for your group of friends, family group, or corporate event. Our certified tour guide will join you on a relaxing full-day trip from San Francisco. You will follow Highway 1 to the beautiful Monterey Peninsula, visit Steinbeck's Cannery Row, travel through the famous 17-Mile Drive, and see Pebble Beach Golf Course. Finish your day with a stop at the coastal town of Carmel-by-the-Sea before returning to San Francisco.",2480.57,"More than 4 hours"
179,"Napa or Sonoma Private Wine Tour from San Francisco",5.0,1,8.0,1,1,"Visit California’s top wine region. Napa Valley and Sonoma are world renowned for their wine making and are home to so many wineries Pick the date, time and the wineries that work best for you and meet our driver at your preferred pick up address. Travel Napa Valley in a luxurious and comfortable sedan that can accommodate up to 4 passengers.",NULL,"More than 4 hours"
180,"Guided E-Bike tour to Muir Woods",5.0,1,6.0,0,1,"Want to combine a scenic E-bike tour with a hike inside Muir Woods? Then this tour may be for you! After we meet at North Beach, where we will get your E-bikes, we will make our way along the scenic northern SF shore, across the Golden Gate Bridge, through Sausalito and finally along more scenic roads until we reach Muir Woods. After your hike inside the National Park, we will typically ride back to the Sausalito Ferry so that you can enjoy a ferry ride that takes you back to SF, also offering great close by views from Alcatraz. Total distance of this tour (on the bicycle) is 25 miles, and it will take around 6 hours (at least 4 HOURS PEDALLING!). PLEASE SEE EXCLUSIONS FOR TOTAL COST OF THIS TOUR!",50.11,"More than 4 hours"
181,"San Francisco, Golden Gate, Sausalito and Muir Woods Private Tour",NULL,0,8.0,1,1,"Embark on an exclusive private tour of San Francisco, Golden Gate, Sausalito & Muir Woods where every moment is yours to shape! Capture the awe-inspiring beauty of the Golden Gate Bridge, and customize your Sausalito experience – be it shopping, gallery hopping, or a leisurely waterfront lunch. Venture into the ancient redwoods of Muir Woods, choosing the pace of your exploration. This isn't just a tour; it's your personalized journey. Tailor each stop to your interests, guided by our experienced concierge. Whether you crave culture, nature, or iconic landmarks, every detail is crafted to suit your preferences. Engage with the vibrant spirit of San Francisco and create memories that resonate with your travel dreams. Flexibility and exclusivity define this private adventure – your way. Book now to discover San Francisco, Golden Gate, Sausalito & Muir Woods on a tour designed uniquely for you!",344.51,"More than 4 hours"
182,"Half Day Private Champagne Wine Tour to Sonoma and Napa",NULL,0,7.5,1,1,"Sparkling Wine production started in the 17th century in France, when a monk named Dom Pierre Pérignon planted vines. Ruinart, the oldest established Champagne house, was founded in 1729 and began shipping bubbly in 1764. The style gained in popularity among French and English nobility. In 1745, Moët & Chandon became the first purveyor to a European royal court, at the court of King Louis XV. Veuve Clicquot was then founded in 1772. Among other things, Madame Clicquot invented the riddling process to remove yeast after secondary fermentation, creating the traditional method of méthode champenoise. Sparkling wines have been produced in the California since the 1860s During this tour we will visit 2 different Sparkling wine wineries. You choose from Gloria Ferrer, Taittinger, Mumm, and Chandon. Visit the two best sparkling wineries in Sonoma and Napa. Have lunch in one of the restaurants in Sonoma or Napa. Visit local souvenir shops and art galleries. Enjoy scenery and architecture.",1478.13,"More than 4 hours"
183,"Private Full Day Tour to Sillicon Valley from San Francisco with Hotel pick-up",NULL,0,8.0,1,1,"Pick up will be from your hotel or place of choice inside the city of San Francisco. After meeting with your driver and official tour guide, we will head towards Silicon Valley. Before leaving San Francisco, and depending where your hotel/accommodation is located, you will enjoy a brief panoramic view of the city. This would include having a view of Golden Gate Bridge as well as Fisherman’s Wharf. We will head towards the Santa Clara Valley to reach Silicon Valley. In Silicon Valley, you can find the startups and the technological companies. The drive will be around 40 minutes. Our driver and guide will be at your disposition during the full day tour and will explain many anecdotes and stories about Silicon Valley and their geniuses! We will arrange a stop to the headquarters of Facebook, Peers Park of Palo Alto, Stanford University, Google, Apple Park Visitor Center and much more! We will pass by a garage where Bill Hewlett and David Packard started HP and many more.",2294.77,"More than 4 hours"
184,"5 hours private napa wine tour from san francisco up to 7 people",NULL,0,5.0,1,1,""We treat you lik a King" here at king tut we specilize in small private wine tour we will visit 3 winery we stop at V.Satutti for picnic lunch you will visit and view and you can test premier wine at our beautful wine country",352.87,"More than 4 hours"
185,"Private Tour to Muir Woods, Sausalito, Marin Headlands, Point Bonita Lighthouse",3.0,2,7.0,1,1,"Taking pictures at the Golden Gate Bridge near Lone Sailor Monument Visiting Muir Woods: coastal sequoias - tallest trees in the world. Visiting Sausalito: a beautiful little town with stunning views of the Bay, Bridges, and downtown SF. Lunch in one of many seafood restaurants. Souvenir shops and art galleries. Visiting Marin Headlands. See panoramic views of the ocean and the bay. Visiting 923-foot high Hawk Hill where a coast artillery battery was built during WWII to protect the Bay entrance. Visiting the world’s largest marine mammal hospital where injured, ill, or abandoned sea animals are rescued, rehabilitated, and released. Visiting the Nike Missile Site, the last line of defense against air attack. Visiting Point Bonita Lighthouse, located at the Bay entrance, a 56-foot tower, built in 1855 at 306 feet above sea level Visiting Fort Baker-Cavallo Point, a military base just under the Golden Gate Bridge, on its northern side.",695.30,"More than 4 hours"
186,"8 Hour Napa and Sonoma Valley tour",NULL,0,8.0,1,1,"Be whisked away by private vehicle to the Napa and Sonoma valleys on a personalized, 8-hour wine tour. You'll benefit from an itinerary, which makes for an unforgettable excursion in this premier wine region of Northern California, located just 45 miles north of San Francisco. Pricing is per group, based on a maximum of six people; wine tasting fees not included.",709.92,"More than 4 hours"
187,"Muir Woods, Sausalito and San Francisco City Combo Private Tour",NULL,0,6.0,1,0,"Enjoy your combo City and Muir Woods Tour with Beautiful Town of Sausalito in comfortable luxury sedan with chauffeur guide making live commentary while take you  to World Famous Muir Woods National Monument to see coastal redwood trees also known as seqoias and enjoy the serenity of Mother Nature and feel a spirit of John Muir famous Scottish Naturalist and Tree Hugger.Many hiking trails awaiting of you.Also you can enjoy a cup of coffee wit fresh pastry in local cafeteria and also buy some souvenirs. After Muir Woods we go to town of Sausalito known for small boutique shops,art galleries and great restaurants.After Sausalito we go back to San Francisco and we stop at Golden Gate Bridge for Photos.And we start our City Tour visiting famous landmarks such as:Palace of Fine Arts,Presidio,Ms Doubtfire House,Lombard Street,Fisherman Wharf,Embarcadero,Golden Gate Park,Lands End,Ocean Beach,Twin Picks,Haight and Ashbury,Mission,Castro and Painted Lades.",1044.00,"More than 4 hours"
188,"Private Tour Muir Woods and Sausalito",5.0,1,4.0,1,1,"his Tour will take you across the Golden Gate Bridge, walk among old growth coast redwoods of the famous Muir Woods National Monument Park. You will discover some of the most beautiful house boats in the world, where a hippie community took residence in the 70's and admire the beautiful seaside Mediterranean style City of Sausalito. The transportation will be in a luxury brand new Porsche Macan with only 4 passenger total and your guide. You will have a particular attention from your tour guide during all your trip.",555.87,"More than 4 hours"
189,"Private Wine Tour Napa or Sonoma from $99 per person up to 7 & Concierge Service",NULL,0,6.0,1,1,"Wine country tours stars in your hotel or residence in Napa,Sonoma or East Bay. San Francisco area and airport pick-ups are extra. Drivers gratuity of 20 % will be charged to the full amount of the excursion. We can help you with your itinerary once you'll book your reservation. All of our drivers are experienced and familiar with the wine country and can make recommendations on the day of the service. Wineries tasting fees are not included.",516.80,"More than 4 hours"
190,"8 Hour Napa and Sonoma Valley tour",NULL,0,8.0,1,1,"Be whisked away by private vehicle to the Napa and Sonoma valleys on a personalized, 8-hour wine tour. You'll benefit from an itinerary, which makes for an unforgettable excursion in this premier wine region of Northern California, located just 45 miles north of San Francisco. Pricing is per group, based on a maximum of six people; wine tasting fees not included.",709.92,"More than 4 hours"
191,"Muir Woods, Sausalito and San Francisco City Combo Private Tour",NULL,0,6.0,1,0,"Enjoy your combo City and Muir Woods Tour with Beautiful Town of Sausalito in comfortable luxury sedan with chauffeur guide making live commentary while take you  to World Famous Muir Woods National Monument to see coastal redwood trees also known as seqoias and enjoy the serenity of Mother Nature and feel a spirit of John Muir famous Scottish Naturalist and Tree Hugger.Many hiking trails awaiting of you.Also you can enjoy a cup of coffee wit fresh pastry in local cafeteria and also buy some souvenirs. After Muir Woods we go to town of Sausalito known for small boutique shops,art galleries and great restaurants.After Sausalito we go back to San Francisco and we stop at Golden Gate Bridge for Photos.And we start our City Tour visiting famous landmarks such as:Palace of Fine Arts,Presidio,Ms Doubtfire House,Lombard Street,Fisherman Wharf,Embarcadero,Golden Gate Park,Lands End,Ocean Beach,Twin Picks,Haight and Ashbury,Mission,Castro and Painted Lades.",1044.00,"More than 4 hours"
192,"Private Tour Muir Woods and Sausalito",5.0,1,4.0,1,1,"his Tour will take you across the Golden Gate Bridge, walk among old growth coast redwoods of the famous Muir Woods National Monument Park. You will discover some of the most beautiful house boats in the world, where a hippie community took residence in the 70's and admire the beautiful seaside Mediterranean style City of Sausalito. The transportation will be in a luxury brand new Porsche Macan with only 4 passenger total and your guide. You will have a particular attention from your tour guide during all your trip.",555.87,"More than 4 hours"
193,"Private Wine Tour Napa or Sonoma from $99 per person up to 7 & Concierge Service",NULL,0,6.0,1,1,"Wine country tours stars in your hotel or residence in Napa,Sonoma or East Bay. San Francisco area and airport pick-ups are extra. Drivers gratuity of 20 % will be charged to the full amount of the excursion. We can help you with your itinerary once you'll book your reservation. All of our drivers are experienced and familiar with the wine country and can make recommendations on the day of the service. Wineries tasting fees are not included.",516.80,"More than 4 hours"
194,"San Francisco: Discover The Must See In A Day",NULL,0,7.0,0,1,"It would be impossible to discover everything that San Francisco has to offer in just one day, but with a local by your side you can certainly try! Discover the city’s highlights and the most famous sights, seeing its iconic landmarks and ticking the top spots off your SF bucket list. Even with only one day to explore, you can visit a few of the top attractions as well as a few secret local spots along the way! So get the best of both worlds as you see SF’s most famous sights like Pier 39, Golden Gate Park and Chinatown as well as hidden gems that are just around the corner that only the locals know about!",245.36,"More than 4 hours"
195,"San Francisco city tour & Muir Woods / Sausalito",NULL,0,8.0,1,1,"San Francisco offers myriad possibilities to explore and you can customize your itinerary on this private half-day tour. Let a personal guide lead you through city highlights such as Ghirardelli Square, Lands End, Golden Gate Park, or Union Square.  Round-trip hotel is provided by private vehicle.",364.05,"More than 4 hours"
196,"See San Francisco With A Local: Private & Personalized",5.0,1,3.0,0,1,"We could tell you how special San Francisco is but it is something you need to experience first hand. Don't let time constraints put you off. Whether you have one or two hours or a full day to spare, one of our local San Francisco hosts will create an itinerary according to your schedule and interests. With dramatic cliff top views (hopefully you’re not afraid of heights) to the food trucks that are part of the city's staple food scene, you’ll get an all- encompassing experience of this city. Within 24 hours after booking you'll receive a short questionnaire about your personality and interests. Based on your responses, you'll be assigned a like-minded host. Your host will communicate with you directly to suggest an itinerary to help you discover what makes the city unique. You will also agree on a meeting time and place. Your itinerary is flexible, so during the experience, you can always change your mind about what you want to do",116.14,"More than 4 hours"
197,"Golden Gate Bridge Bike Rental with Sausalito Ferry Return",NULL,0,10.0,0,1,"Measuring 48 square miles, San Francisco is famous for its scenic beauty, cultural attractions, diverse communities, and world-class cuisine. Dotted with landmarks like the Golden Gate Bridge, cable cars, Fisherman’s Wharf, Alcatraz, Chinatown, Union Square, North Beach, the Castro District and Mission Dolores, the City’s streets have intriguing neighborhoods to explore at every turn. Unlimited Biking will arm you with everything you need for your adventure. The ferry boat ticket is a one-way ticket from Sausalito to San Francisco on the Blue and Gold Ferry. Passengers are allowed to board the ferry with their bike. Unlimited Biking team members will let them know the updated schedule on their arrival, or guests can check for updated schedules on the Blue and Gold ferry website. This ferry ticket is valid for any ferry times.",52.26,"More than 4 hours"
198,"Gold Rush to Golden Gate: Self-Guided Tour of San Francisco",4.8,4,2.0,0,1,"Professional tour guide and city Insider, Brad Prickett, hosts you on a tour of San Francisco. GPS-activated audio plays automatically on your phone as you learn the colorful history and see the top attractions along San Francisco’s waterfront and across the iconic Golden Gate Bridge. Drive the tour at your own pace, using your phone as your guide. Learn the history, hear the stories of San Francisco’s founders, scoundrels and visionaries as you visit.",8.10,"More than 4 hours"
199,"8-Hours Napa Wine Tour from San Francisco to Napa CA , Sedan up to 4 People",NULL,0,8.0,1,1,"We specialize in Napa Valley Wine Country Tours and our knowledgeable staff and professional chauffeurs help make every single trip one you will never forget. With an ability to customize every Napa Valley excursion to your specific liking we can help you formulate an itinerary to your specific taste and desires. If you are not familiar with the Napa Valley Wine Country we can help make your trip memorable by taking into account your tastes, budget and any other preferences you may have. We will make your trip truly yours.",913.50,"More than 4 hours"
200,"Exclusive Napa Valley Wine Tour",5.0,1,6.0,1,0,"Spending extended time in San Francisco? What a better way to spend your day than a romantic, relaxing San Francisco to Napa Valley Wine Tour—without your car! Leave the itinerary and transportation to us. Sit back, relax, and enjoy our 6-hour private wine tasting tours that start in San Francisco and head about an hour north to the vineyard-draped hills of Napa Valley. Take in the beauty of the rolling hills speckled with magnificent oak trees and lush vineyards. We’ll take you from San Francisco to Napa Valley for a full day of wine tasting experiences at some of the best Napa wineries in the world. With several hundred wineries to choose from, you will taste a wide array of wines and experience the unique ambiance of each winery.",528.26,"More than 4 hours"
201,"8-Hours Private Limo(up to 8 pass.) Wine Tour of Napa Valley from San Francisco",5.0,11,8.0,1,1,"Your private limousine and driver will guide you through the wine country and help you discover the many wonders of the valley. You can experience tasting a glass of full-bodied Cab in a cave straight from a barrel or the fun of kicking off your shoes and grape stomping during harvest season. Try food and wine pairings at various wineries or just simply take a romantic private wine tour and relax in the comfort of a private limo.",1286.74,"More than 4 hours"
202,"Full Day - Ultimate City Tour Plus Redwoods & Sausalito Private Tour by Jeep",5.0,8,7.0,0,1,"Muir Woods in the morning and City Tour in the afternoon In the Morning: Start in Fisherman's Wharf then over the Golden Gate Bridge North to the Muir Woods National Monument to see the giant redwoods. Your visit inside the park is self-guided. Your guide will be waiting for you after your park visit. Stop at Muir Beach Overlook to catch a view of the Pacific Ocean. Stop in the bayside town of Sausalito. A quick stop for grab-and-go lunch in Sausalito Stop at Golden Gate Bridge overlook on the way back to san Francisco In the Afternoon: Two to Three-hour San Francisco tours cover many of the major sites: Fisherman's Wharf, Union Square, Presidio, Golden Gate Park, Twin Peaks, Chinatown, Lombard Street (traffic permitting), Coit Tower, and North Beach (“Little Italy”). Our Jeeps fit up to 4 adults and 2 children. The 3rd row seating is perfect for children and teens.",628.84,"More than 4 hours"
203,"Shore Excursion: Coastal Redwoods of Muir Woods National Monument Half-Day Tour",4.4,10,4.5,0,1,"Just minutes from your cruise ship, you can disembark and join us on a variety of departure times for our Muir Woods Tour available at 8:30am and 1:30pm, where you will be quickly whisked away to redwood country here in Northern California. Venture north over the Golden Gate Bridge to an isolated canyon filled with ancient coastal redwood trees, also known as Muir Woods National Monument. Enjoy solitude and peace, through the cool, moist air, as you stroll through 1000-year-old trees towering 260 feet tall.",83.52,"More than 4 hours"
204,"Private Muir Woods and Sausalito Half-Day Tour from San Francisco",NULL,0,6.0,1,1,"Enjoy this private half-day tour to get to know Muir Woods and Sausalito. Pick up will be set from your hotel in San Francisco. Then the tour will begin and your driver will take you towards Muir Woods. Muir Woods will be your first stop. Spend around 2 hours there. Entrance tickets are included to Muir Woods. After Muir Woods, your driver will take you towards Sausalito. Enjoy around 1 hour visit in Sausalito before taking you back toward your hotel in San Francisco. Your private Guide driver is at your disposal during the whole half-day tour and then they will drop you off at your hotel.",1155.88,"More than 4 hours"
205,"Alcatraz and Streets of San Francisco Guided Electric Bike Tour",4.9,9,4.0,0,0,"Enjoy a Two-Day Two-Tour Alcatraz & Electric Bike Tour Package. This tour includes the official trip to Alcatraz island and a professionally guided bike tour. Check these Two Top-Ten visitor experiences OFF your bucket list with this package deal.",177.19,"More than 4 hours"
206,"Amazing Muir Woods and Sausalito Tour",4.7,16,5.0,0,1,"This tour will take you to Muir Woods National Monument and Sausalito in a comfortable 14 passenger Mercedes sprinter van. We provide a boutique, personal experience with knowledgeable local guides in small groups.",76.40,"More than 4 hours"
207,"6-Hours Customized Private NAPA Valley Wine Tour From San Francisco Bay Area",NULL,0,6.0,0,1,"We provide customized and private wine tours to Napa Valley Wine country from San Francisco Bay area. We will begin your day of wine tour and tasting adventure. You can sit back and relax in your private luxury Sedan, SUV, Sprinter, Limo or Charter Bus as you take in the scenic wonders of the wine country, and spend the day tasting wine. Napa Valley It has long been famous for its ability to grow Bordeaux grapes such as Cabernet Sauvignon & Sauvignon Blanc, a home to almost 300 wineries, most of which line Highway 29. -Enter your pickup location; your home, hotel or any location of your choice -Your Winery destination is totally customizable. Choose your winery destinations. NOTE: Wine tasting fees are NOT included. Most wineries require advanced reservations, please make sure to book ahead. We only provide transportation service to the wineries of your choice. Minimum drinking age is 21, wineries will require ID. Credit card is required to reserve. Chauffeur gratuity NOT included.",747.80,"More than 4 hours"
